{
  "schema_version": "1.0",
  "execution_id": "73000000-0000-4000-8000-000000000001",
  "lease_version": 1,
  "state": "completed",
  "started_at": "2026-08-05T08:00:10Z",
  "completed_at": "2026-08-05T08:03:10Z",
  "agent_version": "0.1.0",
  "adb_version": "Android Debug Bridge version 1.0.41",
  "artifacts": [
    {
      "artifact_id": "75000000-0000-4000-8000-000000000001",
      "kind": "startup_trace",
      "mime": "application/x-perfetto-trace",
      "size": 1048576,
      "sha256_b64": "AAAAAAAAAAAAAAAAAAAAAAAAAAAAAAAAAAAAAAAAAAA="
    }
  ],
  "scenarios": [
    {
      "scenario_type": "startup",
      "state": "completed",
      "started_at": "2026-08-05T08:00:10Z",
      "completed_at": "2026-08-05T08:00:30Z",
      "temperature_start_c": 31.5,
      "temperature_end_c": 32.0,
      "artifact_ids": ["75000000-0000-4000-8000-000000000001"],
      "diagnostic_code": null
    }
  ],
  "diagnostic_code": null
}
